[2026-02-03 21:00:01] === Auto-sync started ===
ok=== Claude Code Config Sync - Incremental Backup ===

[1/6] Checking settings.json...
[2/6] Checking scripts...
[3/6] Checking skills...
  Total skills: 57
[4/6] Checking hooks...
[5/6] Checking plugins...
[6/6] Checking shell aliases...

=== No changes detected ===
Everything is already in sync.
Running pre-commit sync...
=== Claude Code Config Sync - Incremental Backup ===

[1/6] Checking settings.json...
[2/6] Checking scripts...
[3/6] Checking skills...
  [UPDATED] skills/claudeception

New changes detected from sync!
These will be included in this commit.

[main 26a6019] Auto-sync: 2026-02-03 21:00
 9 files changed, 281 insertions(+), 112 deletions(-)
 create mode 100644 auto-sync.log
 create mode 100644 handoff.log
 create mode 100755 hooks/auto-handoff.sh
 create mode 100755 scripts/auto-handoff-hook.sh
 delete mode 100755 scripts/auto-handoff.sh
To https://github.com/khursanirevo/claude-config-sync.git
   fb8808e..26a6019  main -> main
[2026-02-03 21:00:04] === Auto-sync complete (changes pushed) ===
ok
[2026-02-04 21:00:01] === Auto-sync started ===
ok=== Claude Code Config Sync - Incremental Backup ===

[1/6] Checking settings.json...
[2/6] Checking scripts...
[3/6] Checking skills...
  [UPDATED] skills/claudeception
Running pre-commit sync...
=== Claude Code Config Sync - Incremental Backup ===

[1/6] Checking settings.json...
[2/6] Checking scripts...
[3/6] Checking skills...
  [UPDATED] skills/claudeception

New changes detected from sync!
These will be included in this commit.

[main f7fe3ae] Auto-sync: 2026-02-04 21:00
 3 files changed, 130 insertions(+)
 create mode 100644 .handoff_state.json
To https://github.com/khursanirevo/claude-config-sync.git
   26a6019..f7fe3ae  main -> main
[2026-02-04 21:00:03] === Auto-sync complete (changes pushed) ===
ok
[2026-02-05 21:00:01] === Auto-sync started ===
ok=== Claude Code Config Sync - Incremental Backup ===

[1/6] Checking settings.json...
[2/6] Checking scripts...
[3/6] Checking skills...
  [UPDATED] skills/claudeception
Running pre-commit sync...
=== Claude Code Config Sync - Incremental Backup ===

[1/6] Checking settings.json...
[2/6] Checking scripts...
[3/6] Checking skills...
  [UPDATED] skills/claudeception

New changes detected from sync!
These will be included in this commit.

[main 481ffbc] Auto-sync: 2026-02-05 21:00
 3 files changed, 453 insertions(+), 6 deletions(-)
To https://github.com/khursanirevo/claude-config-sync.git
   f7fe3ae..481ffbc  main -> main
[2026-02-05 21:00:04] === Auto-sync complete (changes pushed) ===
ok
[2026-02-06 21:00:01] === Auto-sync started ===
ok=== Claude Code Config Sync - Incremental Backup ===

[1/6] Checking settings.json...
[2/6] Checking scripts...
[3/6] Checking skills...
  [UPDATED] skills/claudeception
Running pre-commit sync...
=== Claude Code Config Sync - Incremental Backup ===

[1/6] Checking settings.json...
[2/6] Checking scripts...
[3/6] Checking skills...
  [UPDATED] skills/claudeception

New changes detected from sync!
These will be included in this commit.

[main cce38d2] Auto-sync: 2026-02-06 21:00
 3 files changed, 548 insertions(+), 15 deletions(-)
 delete mode 100644 .handoff_state.json
To https://github.com/khursanirevo/claude-config-sync.git
   481ffbc..cce38d2  main -> main
[2026-02-06 21:00:04] === Auto-sync complete (changes pushed) ===
ok
[2026-02-07 21:00:01] === Auto-sync started ===
ok=== Claude Code Config Sync - Incremental Backup ===

[1/6] Checking settings.json...
[2/6] Checking scripts...
[3/6] Checking skills...
  [UPDATED] skills/claudeception
Running pre-commit sync...
=== Claude Code Config Sync - Incremental Backup ===

[1/6] Checking settings.json...
[2/6] Checking scripts...
[3/6] Checking skills...
  [UPDATED] skills/claudeception

New changes detected from sync!
These will be included in this commit.

[main a314cb2] Auto-sync: 2026-02-07 21:00
 2 files changed, 357 insertions(+)
To https://github.com/khursanirevo/claude-config-sync.git
   cce38d2..a314cb2  main -> main
[2026-02-07 21:00:03] === Auto-sync complete (changes pushed) ===
ok
[2026-02-08 21:00:01] === Auto-sync started ===
ok=== Claude Code Config Sync - Incremental Backup ===

[1/6] Checking settings.json...
[2/6] Checking scripts...
[3/6] Checking skills...
  [UPDATED] skills/claudeception
Running pre-commit sync...
=== Claude Code Config Sync - Incremental Backup ===

[1/6] Checking settings.json...
[2/6] Checking scripts...
[3/6] Checking skills...
  [UPDATED] skills/claudeception

New changes detected from sync!
These will be included in this commit.

[main dea2bc5] Auto-sync: 2026-02-08 21:00
 2 files changed, 261 insertions(+)
To https://github.com/khursanirevo/claude-config-sync.git
   a314cb2..dea2bc5  main -> main
[2026-02-08 21:00:03] === Auto-sync complete (changes pushed) ===
ok
[2026-02-09 21:00:01] === Auto-sync started ===
ok=== Claude Code Config Sync - Incremental Backup ===

[1/6] Checking settings.json...
[2/6] Checking scripts...
[3/6] Checking skills...
cp: cannot create directory 'skills/claudeception': No space left on device
error: unable to create temporary file: No space left on device
error: auto-sync.log: failed to insert into database
error: unable to index file 'auto-sync.log'
fatal: updating files failed
fatal: sha1 file '/home/sani/claude-config-sync/.git/index.lock' write error. Out of diskspace
Everything up-to-date
[2026-02-09 21:00:03] === Auto-sync complete (changes pushed) ===
ok
[2026-02-10 21:00:01] === Auto-sync started ===
ok=== Claude Code Config Sync - Incremental Backup ===

[1/6] Checking settings.json...
[2/6] Checking scripts...
[3/6] Checking skills...
  [NEW] skills/claudeception
Running pre-commit sync...
=== Claude Code Config Sync - Incremental Backup ===

[1/6] Checking settings.json...
[2/6] Checking scripts...
[3/6] Checking skills...
  [UPDATED] skills/claudeception

New changes detected from sync!
These will be included in this commit.

[main 0d920ce] Auto-sync: 2026-02-10 21:00
 3 files changed, 464 insertions(+)
 create mode 100644 .handoff_state.json
To https://github.com/khursanirevo/claude-config-sync.git
   dea2bc5..0d920ce  main -> main
[2026-02-10 21:00:05] === Auto-sync complete (changes pushed) ===
ok
[2026-02-11 21:00:01] === Auto-sync started ===
ok=== Claude Code Config Sync - Incremental Backup ===

[1/6] Checking settings.json...
[2/6] Checking scripts...
[3/6] Checking skills...
  [UPDATED] skills/claudeception
Running pre-commit sync...
=== Claude Code Config Sync - Incremental Backup ===

[1/6] Checking settings.json...
[2/6] Checking scripts...
[3/6] Checking skills...
  [UPDATED] skills/claudeception

New changes detected from sync!
These will be included in this commit.

[main db253f4] Auto-sync: 2026-02-11 21:00
 3 files changed, 353 insertions(+), 8 deletions(-)
To https://github.com/khursanirevo/claude-config-sync.git
   0d920ce..db253f4  main -> main
[2026-02-11 21:00:04] === Auto-sync complete (changes pushed) ===
ok
[2026-02-12 21:00:01] === Auto-sync started ===
ok=== Claude Code Config Sync - Incremental Backup ===

[1/6] Checking settings.json...
[2/6] Checking scripts...
[3/6] Checking skills...
  [UPDATED] skills/claudeception
Running pre-commit sync...
=== Claude Code Config Sync - Incremental Backup ===

[1/6] Checking settings.json...
[2/6] Checking scripts...
[3/6] Checking skills...
  [UPDATED] skills/claudeception

New changes detected from sync!
These will be included in this commit.

[main 9fbb018] Auto-sync: 2026-02-12 21:00
 3 files changed, 328 insertions(+), 9 deletions(-)
To https://github.com/khursanirevo/claude-config-sync.git
   db253f4..9fbb018  main -> main
[2026-02-12 21:00:04] === Auto-sync complete (changes pushed) ===
ok
[2026-02-13 21:00:01] === Auto-sync started ===
ok=== Claude Code Config Sync - Incremental Backup ===

[1/6] Checking settings.json...
[2/6] Checking scripts...
[3/6] Checking skills...
  [UPDATED] skills/claudeception
Running pre-commit sync...
=== Claude Code Config Sync - Incremental Backup ===

[1/6] Checking settings.json...
[2/6] Checking scripts...
[3/6] Checking skills...
  [UPDATED] skills/claudeception

New changes detected from sync!
These will be included in this commit.

